Category,Supporting Ministry,Community,Project,Status,Target Completion Date,Description,Result,Area,Region,Address,Postal Code,Highway / Transit Line,Estimated Total Budget,Municipal Funding,Provincial Funding,Federal Funding,Other Funding,Website,Latitude,Longitude
Health care,Health,Toronto,The Salvation Army Toronto Grace Health Centre Infrastructure Upgrades,Complete,Jun-17,"Upgrades to more than 70,000 sq. ft. to TGHC and renovations to more than 50,000 sq. ft. of space at UHN Hillcrest","Improvements to air quality for patients and staff, safety in patient rooms, washrooms and showers; patients will be able to find and use programs and services more easily",Toronto,Central,650 Church St,M4Y 2G5,,28598567,,Yes,,Yes,http://www.torontograce.org/about-tghc/our-present/,43.670326,-79.383202
Health care,Health,Toronto,University Health Network - Bickle Centre Infrastructure Upgrades ,Complete,Apr-20,"Renovations including mould remediation, improvements to lighting and millwork in patient rooms and nursing stations, as well as the installation of medical gases and suction units to the bedside","Access to medical gas and suction outlets at all 224 beds, improved accessibility in washrooms, and upgraded fire safety, electrical, mechanical and structural systems",Toronto,Central,130 Dunn Ave,M5G 2C4,,24456800,,Yes,,Yes,http://www.uhn.ca/corporate/AboutUHN/OurHospitals/TR_Bickle/Pages/building_better_bickle.aspx,43.634803,-79.432709
Health care,Health,Toronto,West Park Healthcare Centre - DBFM Brownfield Capital Redevelopment Project,Under construction,Mar-23,Construction of a new multi-storey building to replace old building,"Increased capacity for inpatient, ambulatory care, outreach, diagnostic and therapeutic services with a capacity of up to 314 beds (up to a 54-bed increase) upon opening.",Toronto,Central,82 Buttonwood Ave,M6M 2J5,,972418700,,Yes,,Yes,http://www.infrastructureontario.ca/West-Park-Healthcare-Centre/,43.690044,-79.508181
Health care,Health,Toronto,William Osler Health System - Etobicoke General Hospital New Patient Tower,Complete,Feb-19,Construction of a new four-storey tower,"Improved emergency department, critical care services and various ambulatory and support services.  ",Toronto,Central,101 Humber College Blvd,M9V 1R8,,358320300,,Yes,,Yes,http://www.infrastructureontario.ca/Etobicoke-General-Hospital-Redevelopment-Phase1/,43.729423,-79.598176
Health care,Health,Toronto,New Women's College Hospital (Rebuild),Complete,Sep-15,Construction of a new building at the Grenville Street site,"Services from 3 different locations concentrated in new location, while a new Centre of Excellence in Women’s Health will be created in a 630,000-sq. ft. building",Toronto,Central,76 Grenville St,M5S 1B2,,0,,Yes,,Yes,http://www.infrastructureontario.ca/Womens_College_Hospital/,43.661621,-79.387636
Health care,Health,Toronto,University Health Network Princess Margaret Cancer Centre,Complete,May-20,"Creation of additional inpatient allogenic stem cell transplant beds, expanded pharmacy services and creation of laboratory facilities. ","Increased inpatient capacity for allogenic stem cell transplant (STC), expanded pharmacy  services to support growth in SCT, and creation of a laboratory facility to meet provincial wait time standards.",Toronto,Central,610 University Ave,M5G 2M9,,9890900,,Yes,,Yes,http://www.uhn.ca/PrincessMargaret,43.658248,-79.390683
Health care,Health,Toronto,Mount Sinai Hospital - Women's and Infants' Project Phases 1 and 2,Complete,Mar-15,"Construction of a new labour and delivery unit, new neo-natal intensive care unit and level II nurseries, as well as rebuilt antenatal and post-natal units, support service areas and expanded ambulatory care space.  ",,Toronto,Central,600 University Ave,M5G 1X5,,209379421,,Yes,,Yes,,43.657784,-79.389801
Health care,Health,Toronto,North York General Hospital,Complete,Mar-17,Fit-up of two 20-bed inpatient units on the 7th and 8th floors to address needs for negative pressure and isolation inpatient rooms.,,Toronto,Central,4001 Leslie St,M2K 1E1,,16945412,,Yes,,Yes,,43.769759,-79.363174
Health care,Health,Toronto,St. Joseph's Healthcare (Toronto) - Phase 3 and 4 Redevelopment,Complete,Mar-14,This project is the final phase of new construction and renovations to modernize outdated facilities for maternal/newborn service,"Addition of 2 surgical inpatient units, increased  capacity for an up to 6-bed child/adolescent mental health unit, and additional capacity for an up to 28-bed medical unit.  ",Toronto,Central,30 The Queensway,M6R 1B5,,103692217,,Yes,,Yes,,43.640457,-79.450307
Health care,Health,Toronto,Centre Francophone de Toronto CHC,Complete,Mar-15,Leasehold improvements to support the relocation of the CHC.,,Toronto,Central, 555 Richmond Street West,M5V 3B1,,2042626,,Yes,,Yes,,43.646381,-79.402366
Health care,Health,Toronto,South Riverdale Community Health Centre,Complete,Oct-14,"Replace the roof membrane at 955 Queen St East, Toronto.",,Toronto,Central,955 Queen St E,M4M 3P3,,265132,,Yes,,Yes,,43.661167,-79.339267
Health care,Health,Toronto,Humber River Hospital - Reactivation Care Centre,Complete,Apr-19,Reactivation of Humber River Hospital's Church site to open inpatient bed capacity to accommodate alternate level of care patients for various hospitals in the Greater Toronto Area.,,Toronto,Central,200 Church St,M9N 1N8,,31956900,,Yes,,Yes,,43.709334,-79.510366
Health care,Health,Toronto,Sunnybrook Health Sciences Centre - Brain Sciences Centre,Under construction,Aug-23,"The Brain Sciences Centre project includes the construction of a new, 3-storey building adjacent to the existing F-wing on the Bayview campus and renovations in the existing building.  The project will accommodate the expansion of existing adult and youth mental health programs and services.","Additional beds and increased program space, and infrastructure improvement.",Toronto,Central,"2075 Bayview Avenue, ",M4N 3M5,,60000000,,Yes,,Yes,,43.72302401,-79.37291782
Health care,Health,Vaughan,Mackenzie Health - New Vaughan Hospital (formerly York Central Hospital),Complete,Aug-20,Construction of a new hospital to be located in Vaughan and to become the second site of a two-site hospital model for Mackenzie Health,"Expanded services (e.g. acute inpatient and intensive care beds, emergency, surgical, and surgery, diagnostic imaging services) and fully integrated smart technology (first of its kind in Canada)",York,Central,3200 Major Mackenzie Drive West,L4H 3T6,,1352636500,,Yes,,Yes,http://www.infrastructureontario.ca/Mackenzie-Vaughan-Hospital/,43.83562,-79.53245
Health care,Health,Wellington North,North Wellington Health Care Corporation - ER/Ambulatory Care Project,Complete,Aug-21,Redevelopment of the Emergency Department and Ambulatory Care areas . The project also includes the creation space for the Medical Education Facilities at both the Mount Forest and Palmerston sites.  The project will accommodate increased visits to the Emergency Department and Ambulatory Care areas.,Expansion of sevice capacity and infrastructure improvement.,Wellington,Southwest,Wellington North,N0G 2L3,,18496700,,Yes,,Yes,,43.974446,-80.738127
Health care,Health,West Nipissing,West Nipissing Community Health Centre,Complete,Dec-16,"Leasehold improvement of 12,400 sq ft in a former school building in Sturgeon Falls.",,Nipissing,Northeast,145 Main St,P2B 1N8,,4071300,,Yes,,Yes,,46.370136,-79.928545
